Product Review ID,Title,rating,detail_review,upvote,downvote
322,Wonderful,4.0,"Bootup time is excellent, writing review after one month of usage. Display can be better I am ok with it but not disappointed, As am used to external monitor wondering that's the reason am not impressed with display. Haven't really tested the battery so far, will check and update later.Keys are good and well responsive.READ MORE",21,6
322,Did not meet expectations,0.0,"Battery was too bad, worst laptop, sound quality was too bad, it has no backlight key, slow and patchyREAD MORE",5,0
325,Best in the market!,5.0,HIGH PERFORMANCE LAPTOPNO HEATING ISSUESREAD MORE,21,5
325,Just wow!,5.0,NiceREAD MORE,9,2
325,Utterly Disappointed,0.0,"Not worth of money, think twice before buyingProblem start after one monthREAD MORE",7,6
326,Best in the market!,5.0,OsmREAD MORE,94,13
326,Fabulous!,5.0,GoodREAD MORE,97,17
326,Delightful,4.0,"Performance is good, sound quality bit lowBattery back up is around 4 hours without heavy gaming with 90wh battery.READ MORE",23,4
326,Fabulous!,5.0,"Build is good. It takes time to boot, about 20 secs. Unable to choose static keyboard Backlit other than red. Perfomence is expected with the card. Heats a lot till 89 degree in just 5 minutes of gaming.READ MORE",120,52
326,Mind-blowing purchase,5.0,Best one in the budget range 65kREAD MORE,13,2
326,Wonderful,5.0,Igot it for 59k in bbd saleDisplay next level Performance beast 🔥Yes heat like 60 to 80 but it automatically cools.in 10 mints with help of fans Plz plug and play nxt level experienceBattery around 3 hrsREAD MORE,6,0
326,Must buy!,5.0,It really awesome.. just go for it... Value for money 💰.... Don't think about seller.... They doing great work... Amazing service...READ MORE,6,0
326,Simply awesome,5.0,"Nice laptop with great design, it is slightly heavy due to that it is not that much portable because of rtx 3050 obviously it is a gaming laptop if you are office person or in business go for asus slimbooks or apple macbooks don't go for heavy laptops... This laptop is best for gamers , video editors and photo editors.READ MORE",6,0
326,Simply awesome,5.0,Good productREAD MORE,8,2
326,Great product,5.0,Simply outstanding just go for itREAD MORE,7,2
327,Just wow!,5.0,Beauty and the Beast !READ MORE,32,2
327,Worth every penny,5.0,It's a really good leptop...most of all the delevery was good👍it was also very safe👍READ MORE,56,8
327,Mind-blowing purchase,5.0,best performance while gamingREAD MORE,18,1
327,Must buy!,5.0,Best laptop under 83K ...... 🔥READ MORE,17,3
327,Pretty good,4.0,"1. Aesthetically Laptop is Superb.2. Works well3. Slightly heavy weight4.Battery performance is very poor, only one hour backup for normal uses.5. MS Office 365 got free for one year, after long follow-up with Flifkart Customer Care for free offer.READ MORE",13,1
327,Awesome,5.0,"Pros - Great performance, boots up in seconds, 60 fps gaming. Beautiful to look at.Cons - A bit on the heavier side. Hinge is a little weak and might wobble with ceiling fan airREAD MORE",15,3
327,Must buy!,5.0,MSI has made best in its price segement and top of the line performance.READ MORE,4,0
327,Excellent,5.0,Display performance is awesome with 144 mhz refresh rated. Its the best gaming laptop for this price range. No other laptop can match the specs while maintaining a good price like this one does. Its worth of money. It has a top tier GPU with ray tracing tech and 16 GB of RAM along with a RTX 3050 Ti 4Gb graphic cards give you best gaming experience. Laptop cooling system is working perfectly. This combination has yet to be matched at this price range and hence provides the best performance.READ MORE,18,6
327,Just wow!,5.0,"The reason that MSI is best beacuse of th best gaming experience, that you can feel while you play games.Other reason that MSI is best over other laptops is                              .Best build quality                              .smooth performance                              .It contains NVIDIA GETFORCE RTX3050 at this low rateREAD MORE",14,5
327,Awesome,5.0,ExcellentREAD MORE,1,0
328,Just wow!,5.0,"First of all the intel evo battery, loved it watched full ODI match both innings with asus audio boost , with 30% still in the tank , that's almost 9 hrs with hd settings , with battery saver mode you can get easily 11-13hrs .Graphics are very eye appealing , it doesn't strain your eyes and you can view multimedia for long time .Sound quality is phenomenal, if I am two rooms away i can still hear everything clearly , with Dolby Atmos.Very light , aesthetic design, could have made full m...READ MORE",5,0
328,Perfect product!,5.0,The colour and contrast of the screen is simply magnificent.READ MORE,8,2
328,Best in the market!,5.0,It was nice after using a monthREAD MORE,6,2
328,Decent product,3.0,"Flipkart delivery is the worst thing. Take 2+ week to deliver. Product is good and the display is amazing. One complaint is about the keyboard, when in a single click the keyboard duplicating the letter twice or three times. I think it is not good. Other wise good product. And it has only 60 hrz. Overall good product.READ MORE",2,0
328,Wonderful,4.0,V. NiceREAD MORE,1,0
328,Pretty good,4.0,Product is good but worst delivery service by Flipkart.READ MORE,1,0
328,Terrific purchase,5.0,AwesomeREAD MORE,1,0
328,Classy product,5.0,Best value for money with such great build qualityREAD MORE,0,0
328,Perfect product!,5.0,NiceREAD MORE,0,0
329,Did not meet expectations,0.0,"Battery doesn't last at all. But before i could realise battery has an issue, return period is over 6 days after delivery. So now I'm stuck with a 90k laptop with no battery life.READ MORE",58,13
329,Value-for-money,4.0,Battery backup should have been better at this price...READ MORE,28,10
329,Did not meet expectations,0.0,Keyboard is not working hanging problemREAD MORE,52,24
329,Useless product,0.0,"1.Heating issue. 2.Current leakage, current can be felt all over the laptop during charging.READ MORE",26,10
329,Terrific,5.0,Awesome Product... Battery Backup should have been better...Thank you flipkart...READ MORE,4,0
329,Terrific,5.0,Very nice ☺️ congratulations 👏🎉 Life Achievement 👏READ MORE,2,0
329,Highly recommended,5.0,Best laptop and battery backup also good for 3 to 4 hoursREAD MORE,2,0
329,Great product,5.0,Classy. Fast. Costly. Bending angle could have been 180 degrees for this price. Rest ok.READ MORE,3,2
329,Awesome,5.0,"First of all if I talk about performance then I will give 100% score because it is a complete package with an i7 12th gen, 1TB nvme SSD. The look is pretty decent I would say. The keyboard and mouse pad are also good. One more thing is that, the heating problem. Yes of course it has a heating problem because it's a 14 inch laptop and your laptop ventilation is on the back  Better if you use a laptop stand to overcome it. It is a light-weight laptop. That is also a significant work from HP. ...READ MORE",1,0
329,Best in the market!,5.0,Good productsREAD MORE,0,0
330,Nice product,4.0,Good product 😁 👍READ MORE,0,0
331,Super!,5.0,For all those people Who are concerned about the Ram It's Onboard ram With Two 4 GB sticks which makes 8GB ram and IT'S NOT UPGRADABLE...READ MORE,53,4
331,Wonderful,5.0,Makhan leptop 😍..must buy 😊READ MORE,26,2
331,Fabulous!,5.0,Best in the price range.READ MORE,130,28
331,Terrific,5.0,"First of all this is value for money product. If you think that 65k is your budget then obviously you should go for it for business purpose and obviously it's a gaming grade cpu and gpu laptop so any kind of high graphics entry level game you can play in this system. Battery is decent for normal use 3 to 5 hrs for normal use but if you want to use for gaming then you must be plugin the charger. The system have Dolby Atmos for built in speaker, headphones and also inside this system certified ...READ MORE",39,7
331,Terrific purchase,5.0,"The product is very good , if you get it around 50k then it's a good choice better then any other brand laptop , the laptop has all the specs and the performance is very good Only the cons is there is 2 stick of 4gb Ram so if you want to upgrade to 16 GB then you have to remove 2 stick and have to purchase 2 stick of 8 GB thats only fault because I have to purchase 2 stick.Overall I really satisfied from this laptop feels like a macbook in this price I am using since 2 days there is no fau...READ MORE",14,1
331,Excellent,5.0,I bought it on 52k and it is the best laptop on thisREAD MORE,6,0
331,Awesome,5.0,Highly recommendedREAD MORE,5,0
331,Mind-blowing purchase,5.0,"Product is amazing must buy I got this product in 53k best in segment good performance, the best thing with performance it will get finger print unlock buttonRTX 2050 is also a awesome graphicsREAD MORE",4,0
331,Pretty good,4.0,Good product.. silver color is best 🤍READ MORE,4,0
331,Pretty good,4.0,Excellent product 👍READ MORE,4,0
332,Wonderful,5.0,"Oh this one is happiness in a box. Such a vibrant colour and the metal body just adds to the premiumness factor. Stylish and sleek, just loved it. Display is brilliant. Excellent experience offered by an Indian Brand. Kudos to Wings!!READ MORE",66,19
332,Value-for-money,4.0,nice laptop at this price.READ MORE,11,1
332,Worth every penny,5.0,Genuine OSPre Installed MS Office 365 Performing pretty well with all AppsWorth every penny at this Price 😎READ MORE,34,14
332,Good quality product,4.0,1.Overall worth buying at this price range.2.Ms office available only for 5days .3.Battary back is very good.4.Very bad speaker(not able to hear properly)5.No 180 degree hinges(only 95 degree).6.built quality is good.7.Camera is also not good.READ MORE,5,0
332,Great product,5.0,Nice product in this price just one thing keypad backlight not available overall 10 out of 10READ MORE,5,0
332,Good quality product,4.0,Nice laptop at this price 👍READ MORE,5,0
332,Just wow!,5.0,Value for money. Very good display. Relatively good speakersREAD MORE,28,11
332,Good,3.0,"although it is written that there is a back light keyboard feature  in this laptop , this feature is not available ,  so giving 3 start , otherwise it is value for moneyREAD MORE",19,7
332,Simply awesome,5.0,Great product value for moneyMust buy Thanks wings🤩🤩🤩READ MORE,7,1
332,Brilliant,5.0,I purchased this laptop as soon as it was launched later I cancelled and rebooked as the prices were dropped and finally i received the amazing product.Thank wings for meeting my expectations in a very low price. The built is amazing the display is awesome speaker volume is good multiple ports very use able battery is good for a regular user. Overall a must buy in such a low price.READ MORE,9,2
333,Awesome,5.0,Best build quality and performance..READ MORE,21,1
333,Great Laptop,5.0,"I am very happy with the packaging of the product. The delivery was also smooth, it was an open box delivery and the delivery guys were also very cooperative, they waited until I finished my physical inpection of the laptop.  Thanks to flipkart for such a good packaging and supportive delivery persons. The laptop is also quite good, slim and light weight, fast and responsive.However, my i am not happ with how flipkart handles my issue. My laptop was delivered 3 days late, it was hold up in ...READ MORE",53,8
333,Nice product,4.0,"Well to be honest am really satisfied with the product. I am able to play valorant at highest settings without any lags, I wasn't expecting it to handle games so well. However the audio is not the best out there but after turning on dolby atmos it does get better. The main highlight has to be the that awesome vibrant samsungs led display and the premium design.READ MORE",43,7
333,Decent product,3.0,Sound Quality is not good.READ MORE,13,2
333,Good choice,4.0,"This is a high-end variant laptop.  It has many features like fingerprint login, gesture keypad, and one charger for all like if you already have your Samsung phone, the lap charger works for both. The software features are like mentioned in the description.  But things I didn't like about this lap  is its camera, it's a waste, Display Full HD nothing fancy about it,  sound output from the speaker is mediocre.  Overall, it's a good laptop.  But if you are looking for something more specific f...READ MORE",12,2
333,Just wow!,5.0,"Premium Product for Samsung Lovers. Only buy if you are using Samsung Phone because book 3 has Galaxy Ecosystem. Love the multicontrol, 2nd Screen and best part you need not to carry bulky chargers. One charger for all devices. I can charge my s23 ultra with book 3 charger.READ MORE",3,0
333,Good quality product,4.0,"Looks classy but the battery drains very fast. The display is just great but not close to 360, 3Pro or Ultra. Just started using it. Will update after using it for a month.READ MORE",2,0
333,Hated it!,0.0,Very poor sound output and lack of sensorsUnfortunately there's no return policyGot stuck after buying this poor thingREAD MORE,6,4
333,Highly recommended,5.0,Very Good Laptop with fantastic offer priceREAD MORE,5,2
333,Best in the market!,5.0,One of the best in this segment.Highly recommended to buy this.READ MORE,3,1
334,Super!,5.0,everything is just perfect except battery and that's not a problem for me. Absolutely right decision of me to buy this beast. Smooth gaming and editing can be done easily.READ MORE,24,4
334,Just wow!,5.0,GoodREAD MORE,53,16
334,Mind-blowing purchase,5.0,Best laptop at this price range 🔥READ MORE,27,7
334,Pretty good,4.0,Worth of money in this cheap price gaming is best but battery backup is ok ok i recommend to buy this laptopREAD MORE,23,10
334,Highly recommended,5.0,Awesome product .... Best laptop under 63kREAD MORE,3,0
334,Good quality product,4.0,Best laptop under 61kREAD MORE,2,0
334,Perfect product!,5.0,Very nice Laptop by AcerREAD MORE,2,0
334,Terrific,5.0,It's good looking laptop performance is really good and fast but battery drain very fastREAD MORE,0,0
334,Awesome,5.0,Best gaming laptop in this segment 😉❤️READ MORE,1,0
334,Value-for-money,4.0,Everything is good except battery life nearly 2 hours of battery backupREAD MORE,1,0
335,Highly recommended,5.0,Very nice product also it has RGB keyboard if anyone is wonderingREAD MORE,12,0
335,Mind-blowing purchase,5.0,"In one word, AMAZINGjust go for it.I've done a long-long research on laptops present in this segment and believe me it outperforms em allREAD MORE",8,0
335,Wonderful,5.0,"Since there was no product review available, I am sharing one. This is quite a powerful laptop, which comes with a powerful processor and graphics card in this price range. This is a 8GB DDR5 variant, where you can install another 8GB DDR5 RAM, and comes with a 512GB mini SSD(not the 2280, which is mostly available). This gives you an option to install another M.2 NVME standard PCIE SSD in a blank slot.Other than that, performance is best at this price range. And, since this is a performa...READ MORE",4,0
335,Pretty good,4.0,"its much heavier than the specifications . , its 2.6 kgs not 2.3. The vent is through bottom, so must keep elevated else it heats up.  Very good keyboard , looks good ,,READ MORE",2,0
335,Worth the money,4.0,it does have 4zone back lit keyboard (decent quality)overall build is good no flex and hinge is impressive not wobblyspecifications are best in pricebattery 60watt hr gives decent backup as avg gaming laptop supposed to give display is also decent considering this price 😁READ MORE,2,0
335,Mind-blowing purchase,5.0,At 50k this laptop is beast and also this laptop has rgb lightsREAD MORE,2,0
335,Wonderful,5.0,Quality and performance is best in this price rangeREAD MORE,2,0
335,Classy product,5.0,nice 👍🙂READ MORE,3,1
335,Terrific,5.0,"If you are wondering the keyboard is RGB yes it is, display is not up to the markup in terms of colour reproduction but good for gaming, overall very value for money (50k).READ MORE",2,1
335,Awesome,5.0,Value for the money indeed..READ MORE,0,0
336,Just wow!,5.0,"Bought 14 inches, super compact laptop and a very powerful laptop. Having very good experience.READ MORE",25,2
336,Useless product,0.0,Battery works for only 1 or 2 hours max. DO NOT BUYREAD MORE,6,0
336,Very Good,4.0,"Nice and fast compact laptop, enjoying it.READ MORE",3,0
336,Worthless,0.0,I hate it ..!!READ MORE,0,0
336,Terrific,5.0,Good productREAD MORE,0,0
336,Good quality product,4.0,Very good product by Lenovo. You can easily run any progress on visual studio and also ssms . And running very smoothly.READ MORE,0,1
336,Really Nice,4.0,Good productREAD MORE,0,0
337,Nice,3.0,Speaker sound is bit lowREAD MORE,28,5
337,Delightful,4.0,Speaker sound is very low bat performance is goodREAD MORE,10,2
337,Super!,5.0,Value for moneyREAD MORE,9,3
337,Good choice,4.0,Over all laptop is good but disappointed the speaker volume is very less.. performance is so good display has nice.. battery backup is lightly less..READ MORE,2,0
337,Slightly disappointed,0.0,Speaker is bellow average ..Speaker 4 points out of 10Overall 7 points out of 10 .READ MORE,2,0
337,Just okay,3.0,My stylus pen is not workingREAD MORE,3,1
337,Highly recommended,5.0,Very nice. Fast and good touch.READ MORE,1,0
337,Value-for-money,4.0,Very good and nice product.READ MORE,1,0
337,EXCELLENT PRODUCT,5.0,Everything is good. No lag. Touch is smooth. boot time is ok. battery is good.READ MORE,1,0
337,Utterly Disappointed,0.0,Not goodREAD MORE,2,2
338,Awesome,5.0,Good for gaming We can play gta 5 in high settingForza horizon can be played 60 +fpsGood for editing running smooth but coming to battery backup is quite design is super and look8ng slim value for money no heating problem Buid quality is okREAD MORE,2,0
338,Worth every penny,5.0,"I'm writing this after using this laptop for a month,the performance is good,the look is good,but it's quite heavier one,other than the bad thing about this laptop is it's battery backup,while playing game and without plugging it into charger it gave me battery backup of just 2 hours with backlit keyboard off and low brightness,another drawback is that it's inbuilt speaker it sounds very low,Overall a good choice for gaming and performance based....READ MORE",1,0
338,Terrific purchase,5.0,excellent productREAD MORE,0,0
338,Wonderful,4.0,Best laptop under 60 kREAD MORE,0,0
339,Classy product,5.0,Satisfactory and equipped enough to work out almost every taskREAD MORE,235,60
339,Decent product,3.0,"I bought for around 12000 during offer. It is worth for money.Advantages: --It is convertible with touch screen-- lightweight and easy to carry-- performance wise it was good to watch videos and check emails.-- battery backup was very good it usually comes around 4 hours.DisadvantageScreen quality is very poor-- there is no HDmi port ,you have to connect external adaptor to connect with HDMI--you can't install modded apps and many apps were not supporting for this model.READ MORE",111,27
339,Good,3.0,Very good and I am fully satisfiedREAD MORE,109,32
339,Worth the money,4.0,Best in the market .READ MORE,68,20
339,Awesome,5.0,I was completely satisfied with the product but the only issue i was facing is There is no sd card slot in this model So if u are a guy looking to extend your storage using sd card This model is not for you 😞READ MORE,30,7
339,Just wow!,5.0,Nice lookREAD MORE,7,0
339,Value-for-money,4.0,"Good product in this budget range, only some minor issues that I would like to point out.No port for HDMI cable so cannot connect directly to tv need to buy seperate cord for that.Cannot transfer data from laptop to Chromebook using type c slot with USB cable.Cannot install any modded applications easily unlike Android phones.Product is sturdy and has rich finish, very useful for students from high school to bachelor's students but not for engineering students.READ MORE",7,0
339,Does the job,3.0,Nice work home jobREAD MORE,22,5
339,Pretty good,4.0,Nice 👍👍👍READ MORE,13,2
339,Not recommended at all,5.0,"This is the worst product i ever had, it hangs a lot please consider once while ordering itREAD MORE",9,1
340,Terrific purchase,5.0,"Ultimate performanceExtremely good thermals (low heating) (GPU temperature was 71C in warzone)I suggest to use external fan beneath this laptop for minimum temperature I actually have 24gb of ram in this laptop(8+16gb sticks)Preferred ram is minimum 16gb for gamingthis laptop feels like Macbook air in terms of windows 11 optimizationSpeaking of gaming just upgrade the ram to 16gb and just update the rtx 3050 drivers to latest and if the game support dlss , turn on dlss balanced (like in...READ MORE",73,11
340,Highly recommended,5.0,"Been using this device for a month now and I must say for the price I bought it the performance is too good though battery life is not good hardly 2 hours on full charge Overall laptop performance is good, if you want it for gaming, then however you have to connect to power source for better performance Believe me this device with 16 GB RAM will give you excellent performance for 1080p gaming Without any lag because processor is strong enough to handle tough gamesComes with rtx series car...READ MORE",56,9
340,Best in the market!,5.0,"Great value for money product. It got Ryzen7 5000 series and rtx 3050 which is definitely worth it at 65k range (as of 2022 bbd sale).Not great speakers but does the work, has only 120Hz refresh rate screen, also the position of exhaust ducts towards the screen felt pretty odd (seemed like it would melt the screen). Otherwise, it's a great purchase.Also it's highly recommended to upgrade to 16gb ram for even better performance, as i did too.READ MORE",65,14
340,Awesome,5.0,Amaaaazing laptop with besttt performanceREAD MORE,19,3
340,Terrific purchase,5.0,"PERFORMANCE IS ENOUGH FOR GAMERS.BUT BATTERY IS NOT TOO GOOD,I GOT THIS IN 59990.VALUE FOR MONEYREAD MORE",7,0
340,Super!,5.0,"Okay, so I'm using it for the last 7-8 days. Till now no such serious issue. Battery back can be better but as we all know its just 45wh battery so that's expected. Performance wise its smooth. You can see the benchmark score, I have attached the screenshot. I haven't played any games so I can't say much about it. But for content creation purpose I'm using Clip studio paint, animate, premiere pro, krita, photoshop, with graphic pen tablet and I haven't encountered any problems, tasks are supe...READ MORE",56,20
340,Wonderful,5.0,"Superb performanceTake 16GB or Upgrade to 16GB (If taking 8GB).All-rounder.....Game tested Warzone, Battlefield 2042, PUBG, Spiderman, God of War etc....READ MORE",6,0
340,Brilliant,5.0,Just received Use for some day then I will update!READ MORE,15,3
340,Must buy!,5.0,I bought it in 61k and it is worth in that price value for moneyREAD MORE,5,0
340,Terrific purchase,5.0,Very good device in terms of Specification and built quality at this price point surely you should consider buying itREAD MORE,8,1
341,Best in the market!,5.0,HIGH PERFORMANCE LAPTOPNO HEATING ISSUESREAD MORE,21,5
341,Just wow!,5.0,NiceREAD MORE,9,2
341,Utterly Disappointed,0.0,"Not worth of money, think twice before buyingProblem start after one monthREAD MORE",7,6
342,Simply awesome,5.0,Good product . Just slight viewing angles can be better.  Need to register the warranty by uploading invoice from the purchase datesREAD MORE,17,1
342,Horrible,0.0,"Good laptop at the price point.Has warranty issues, hope brand will fix the problem.Lenovo has worse support personnel, lack of knowledge and handling was very evident .Flipkart do not help , so please be careful while you buy expensive products online.READ MORE",155,39
342,Really Nice,4.0,Value for money productREAD MORE,77,21
342,Wonderful,4.0,Good product by Lenovo design and performance both are perfect.READ MORE,21,3
342,Highly recommended,5.0,Amazing laptop. Takes only 2-3 seconds to boot.Blazing fast. More than expected package.READ MORE,91,26
342,Very poor,0.0,Flipkart says in description that laptop has backlit keyboard and 2 yrs warranty. However laptop do not have backlit keyboard and warranty offered is also 1 yr. It's a fraud they are doing.READ MORE,70,23
342,Utterly Disappointed,0.0,Overheating keypad also heating don't buy anyoneAnd warranty also giving 1 yearHere mentioned 2 years Domestic warrantyBut it is fraud.I am talking to Flipkart about warranty but they are giving negligence answersTotally this deal is fraudREAD MORE,10,1
342,Just okay,3.0,"Very good laptop ,best in this price range, battery and performance are superb, storage and and ram is enough for students,only build quality is not good,feels cheaper in the hands, otherwise best in this price rangeREAD MORE",58,25
342,Wonderful,4.0,"Bootup time is excellent, writing review after one month of usage. Display can be better I am ok with it but not disappointed, As am used to external monitor wondering that's the reason am not impressed with display. Haven't really tested the battery so far, will check and update later.Keys are good and well responsive.READ MORE",21,6
342,Did not meet expectations,0.0,"Battery was too bad, worst laptop, sound quality was too bad, it has no backlight key, slow and patchyREAD MORE",5,0
343,Bad quality,0.0,Worst displayREAD MORE,6,2
343,Good choice,4.0,"Pro's nice design, better Battery life upto 6 hours for normal use like working on MS office and 4 hours in watching videosCon's backlit is missing at this priceREAD MORE",3,2
343,Mind-blowing purchase,5.0,"It is compact, light, high quality.Using it for building ASP.NET web applications which is CPU and memory intensive.Though 8 GB is working for me now but would recommend upgrading the RAM to 16 GB minimum.READ MORE",1,0
343,Not good,0.0,Very bad display and too much lagREAD MORE,4,6
343,Delightful,4.0,Decent oneREAD MORE,0,0
343,Decent product,3.0,Inspite of i3 12th gen its a little slow.Apps take time to open.READ MORE,0,0
343,Very poor,0.0,Sound is very lowREAD MORE,0,1
