Product Review ID,Title,rating,detail_review,upvote,downvote
178,Just okay,3.0,"Very good laptop ,best in this price range, battery and performance are superb, storage and and ram is enough for students,only build quality is not good,feels cheaper in the hands, otherwise best in this price rangeREAD MORE",58,25
178,Did not meet expectations,0.0,"Battery was too bad, worst laptop, sound quality was too bad, it has no backlight key, slow and patchyREAD MORE",5,0
179,Wonderful,5.0,Very good product with value 🙂READ MORE,90,13
179,Highly recommended,5.0,"Look and feel of laptop is superb light weight.Sound is really awesome experience,when watching videos.So for not seen such sound quality in laptop.you can happily enjoy watching movies for hours without need any speakerREAD MORE",103,20
179,Must buy!,5.0,"2 day of use.. till now no problem, speed top notch.. little bit low speaker but with good quality.. I will update my review in 2-3 days..ThnqREAD MORE",17,1
179,Mind-blowing purchase,5.0,"Nice product, Value for moneyREAD MORE",69,14
179,Pretty good,4.0,It misses out backlite keyboard and fingerprint reader. Other than that it's goodREAD MORE,38,6
179,Mind-blowing purchase,5.0,"Perfect pc for btech students,, ❣️READ MORE",12,1
179,Worth the money,4.0,"Good design, Good displayLow sound quality, charging time more than two hours, Battery life okREAD MORE",25,5
179,Does the job,3.0,"Pros- Good build quality, good speed, stylishCons- poor speakers (really poor I mean), faces lag in zoom or video calls, during zoom calls even microphone goes haywireREAD MORE",15,2
179,Nice,3.0,"Brought this laptop for rs. 42200 on sale..prosGood build quality (only this laptop of samsung comes with plastic body all other are metallic)sound and display quality is nicePerformance is also good for day to tasks i.e. suitable for students, office worksconsVery poor Camera, No sharpness or contrast.. pictures looks like they are painted128MB graphics. Hangs while playing 4K videosand even with lower version of games it hangs.READ MORE",7,0
179,Super!,5.0,It's goodREAD MORE,7,0
180,Awesome,5.0,BEST LEPTOP BEST PRICE BEST PERFORMANCEREAD MORE,86,11
180,Wonderful,4.0,"After, using two4 to 5 hr battery life in full charging ✌Keyboard awesome  Performance good  Good for coding, and office workREAD MORE",326,70
180,Perfect product!,5.0,Amazing deal in the budget with top class performance and amazing quality 100% satisfiedREAD MORE,103,21
180,Super!,5.0,Everything is goodREAD MORE,37,5
180,Does the job,3.0,SuperREAD MORE,80,16
180,Highly recommended,5.0,Amazing Laptop working coding running fastREAD MORE,36,5
180,Just wow!,5.0,"Nice looking product, display is awesome clarity, performance also good, battery backup is average, totally money worth productREAD MORE",205,53
180,Value-for-money,4.0,The design is nice Performance is good battery .. does not last 7 hours as mentioned but still pretty decent . I have used this for one month now and I don't see any lag or anything. Overall I would rate it nice in this priceREAD MORE,241,69
180,Simply awesome,5.0,Fast delivery was impressive and laptop is above from expectations.... Windows 11 and office with student 2021 was plus pointREAD MORE,12,1
180,Just wow!,5.0,Good product!! Nice performance. Nice display battery is average. Value of money.READ MORE,22,4
181,Perfect product!,5.0,Laptop seems to be Good value for Money. Pros : Nice Processor n Ram Display also Good Sound Quality is Superb.Keyboard also spill free.Performance vise working smoothly. Update the review after a month. Cons : same old type charging process. No type c charging.Power button key very cheap.Build quality is average. Made in China product.READ MORE,84,21
181,Just wow!,5.0,Nice laptopREAD MORE,48,15
181,Nice,3.0,"Configuartions wise okay, but body quality and look wise is not good, keyboard light is not thwre. Will post review again after uaing a monthREAD MORE",6,0
181,Good quality product,4.0,All things are good but the battery backup is too less. Battery running upto 3.5 hours after 100% charge.READ MORE,15,3
181,Worth every penny,5.0,Superb value for moneyREAD MORE,12,2
181,Worst experience ever!,0.0,Worst product don't buy... Battery performance worstREAD MORE,6,1
181,Pretty good,5.0,Everything is good but display in light and volume is average Overall nice productREAD MORE,6,2
181,Super!,5.0,Yaa mone....onnonnara laptop aan ith... 💯READ MORE,4,1
181,Does the job,3.0,"Worst Display, No Backlit keyboard , it is TN panel ,IPS display is excepted for this priceREAD MORE",11,8
181,Decent product,3.0,Good but processor is lightREAD MORE,1,0
182,Very Good,4.0,"Complete value for money package! I am writing this review after using for a month. I am a CS student and  I basically use this laptop for coding and watching movies so let's start :-*DISPLAY - Decent 1080p panel, black levels are close to amoled, brightness is almost sufficient for use in daylight.*PERFORMANCE - Best among all the i3 laptops available in market, never faced any lag till now.*BATTERY - Could have been better, I usually get 3-3.5 hours backup when charged at 80% while watch...READ MORE",103,10
182,Super!,5.0,Nice product for collage freshersREAD MORE,62,6
182,Good choice,4.0,Great experience 🤩✌️READ MORE,40,7
182,Best in the market!,5.0,Best Laptop this budget and awesome display design build quality only 1 disadvantage speakers are not so loudREAD MORE,44,10
182,Mind-blowing purchase,5.0,"Under 35k one of the best laptop so go for it, without any doubt.READ MORE",21,3
182,Pretty good,4.0,the laptop has a good build quality and performane is also good the only problem i faced is in battery and screen ( not protected by glass and shows some whitish area on a little bit of pressure)READ MORE,8,0
182,Fair,3.0,GoodREAD MORE,21,4
182,Terrific purchase,5.0,Portable laptop nice And display is excellent high end performance for office workREAD MORE,31,8
182,Could be way better,0.0,Battery backup is not satisfactoryREAD MORE,6,0
182,Just wow!,5.0,Value for money 💰 Best ProductI fall in love with the Design and Build quantityREAD MORE,20,5
183,Best in the market!,5.0,HIGH PERFORMANCE LAPTOPNO HEATING ISSUESREAD MORE,21,5
183,Just wow!,5.0,NiceREAD MORE,9,2
183,Utterly Disappointed,0.0,"Not worth of money, think twice before buyingProblem start after one monthREAD MORE",7,6
184,Best in the market!,5.0,OsmREAD MORE,94,13
184,Fabulous!,5.0,GoodREAD MORE,97,17
184,Delightful,4.0,"Performance is good, sound quality bit lowBattery back up is around 4 hours without heavy gaming with 90wh battery.READ MORE",23,4
184,Fabulous!,5.0,"Build is good. It takes time to boot, about 20 secs. Unable to choose static keyboard Backlit other than red. Perfomence is expected with the card. Heats a lot till 89 degree in just 5 minutes of gaming.READ MORE",120,52
184,Mind-blowing purchase,5.0,Best one in the budget range 65kREAD MORE,13,2
184,Wonderful,5.0,Igot it for 59k in bbd saleDisplay next level Performance beast 🔥Yes heat like 60 to 80 but it automatically cools.in 10 mints with help of fans Plz plug and play nxt level experienceBattery around 3 hrsREAD MORE,6,0
184,Must buy!,5.0,It really awesome.. just go for it... Value for money 💰.... Don't think about seller.... They doing great work... Amazing service...READ MORE,6,0
184,Simply awesome,5.0,"Nice laptop with great design, it is slightly heavy due to that it is not that much portable because of rtx 3050 obviously it is a gaming laptop if you are office person or in business go for asus slimbooks or apple macbooks don't go for heavy laptops... This laptop is best for gamers , video editors and photo editors.READ MORE",6,0
184,Simply awesome,5.0,Good productREAD MORE,8,2
184,Great product,5.0,Simply outstanding just go for itREAD MORE,7,2
185,Great product,5.0,Overall laptop is nice but screen is not good for watch videos..READ MORE,28,1
185,Moderate,0.0,Actually battery backup is not good it's working for 1 hour or 2 then it's showing 0 battery and the display also not goodREAD MORE,47,8
185,Value-for-money,4.0,Screen is tn panel which limits your viewing angelREAD MORE,64,15
185,Best in the market!,5.0,SuperREAD MORE,6,0
185,Terrific,5.0,Ignore all the reviews who are saying battery backup last 1 to 3 hour. It last almost 5 to 6 hours on 50 to 60 percent brightness and if you are using it on 30 to 40 percentage brightness it will last upto 8 hour. And that is definitely good in this price range.READ MORE,22,5
185,Great product,5.0,Nice productREAD MORE,22,5
185,Wonderful,5.0,Exlient lappy for office and home use good product in minimum priceREAD MORE,18,4
185,Pretty good,4.0,Awesome product in this price. I bought in 28 k. All every day work you can easily do. Battery also good. It will last for 4 hrs .Display not that good but good in this price bracket. Built quickly Also not at par but what you can expect in this price range. Performance wide very good.READ MORE,19,7
185,Just okay,3.0,This laptop has TN panel not VA or ips panel.  If display not matter for you then you can go for this laptop.Battery backup is good.Processor is also goodYou can play games like gta . Battery life is up-to 5hrsREAD MORE,7,1
185,Not recommended at all,0.0,"It has got all the worst. Below par display, under powered processor and GPU and despite that Max three hr battery. Better go for tablet if waxing movie and internet are only requirements atleast three will be good touch display. In any case does nothing more than that. It struggles with basic compilers/interpreters like anaconda itself if programming is requirement. In simple words it's not a computer but media player with worst display. Salt on burn is no upgradablity.READ MORE",30,21
186,Great product,5.0,Overall laptop is nice but screen is not good for watch videos..READ MORE,28,1
186,Moderate,0.0,Actually battery backup is not good it's working for 1 hour or 2 then it's showing 0 battery and the display also not goodREAD MORE,47,8
186,Value-for-money,4.0,Screen is tn panel which limits your viewing angelREAD MORE,64,15
186,Best in the market!,5.0,SuperREAD MORE,6,0
186,Terrific,5.0,Ignore all the reviews who are saying battery backup last 1 to 3 hour. It last almost 5 to 6 hours on 50 to 60 percent brightness and if you are using it on 30 to 40 percentage brightness it will last upto 8 hour. And that is definitely good in this price range.READ MORE,22,5
186,Great product,5.0,Nice productREAD MORE,22,5
186,Wonderful,5.0,Exlient lappy for office and home use good product in minimum priceREAD MORE,18,4
186,Pretty good,4.0,Awesome product in this price. I bought in 28 k. All every day work you can easily do. Battery also good. It will last for 4 hrs .Display not that good but good in this price bracket. Built quickly Also not at par but what you can expect in this price range. Performance wide very good.READ MORE,19,7
186,Just okay,3.0,This laptop has TN panel not VA or ips panel.  If display not matter for you then you can go for this laptop.Battery backup is good.Processor is also goodYou can play games like gta . Battery life is up-to 5hrsREAD MORE,7,1
186,Not recommended at all,0.0,"It has got all the worst. Below par display, under powered processor and GPU and despite that Max three hr battery. Better go for tablet if waxing movie and internet are only requirements atleast three will be good touch display. In any case does nothing more than that. It struggles with basic compilers/interpreters like anaconda itself if programming is requirement. In simple words it's not a computer but media player with worst display. Salt on burn is no upgradablity.READ MORE",30,21
187,Super!,5.0,For all those people Who are concerned about the Ram It's Onboard ram With Two 4 GB sticks which makes 8GB ram and IT'S NOT UPGRADABLE...READ MORE,59,4
187,Wonderful,5.0,Makhan leptop 😍..must buy 😊READ MORE,26,2
187,Fabulous!,5.0,Best in the price range.READ MORE,130,28
187,Terrific purchase,5.0,"The product is very good , if you get it around 50k then it's a good choice better then any other brand laptop , the laptop has all the specs and the performance is very good Only the cons is there is 2 stick of 4gb Ram so if you want to upgrade to 16 GB then you have to remove 2 stick and have to purchase 2 stick of 8 GB thats only fault because I have to purchase 2 stick.Overall I really satisfied from this laptop feels like a macbook in this price I am using since 2 days there is no fau...READ MORE",15,1
187,Terrific,5.0,"First of all this is value for money product. If you think that 65k is your budget then obviously you should go for it for business purpose and obviously it's a gaming grade cpu and gpu laptop so any kind of high graphics entry level game you can play in this system. Battery is decent for normal use 3 to 5 hrs for normal use but if you want to use for gaming then you must be plugin the charger. The system have Dolby Atmos for built in speaker, headphones and also inside this system certified ...READ MORE",39,8
187,Excellent,5.0,I bought it on 52k and it is the best laptop on thisREAD MORE,6,0
187,Awesome,5.0,Highly recommendedREAD MORE,5,0
187,Mind-blowing purchase,5.0,"Product is amazing must buy I got this product in 53k best in segment good performance, the best thing with performance it will get finger print unlock buttonRTX 2050 is also a awesome graphicsREAD MORE",4,0
187,Pretty good,4.0,Good product.. silver color is best 🤍READ MORE,4,0
187,Pretty good,4.0,Excellent product 👍READ MORE,4,0
188,Highly recommended,5.0,Very nice product also it has RGB keyboard if anyone is wonderingREAD MORE,12,0
188,Mind-blowing purchase,5.0,"In one word, AMAZINGjust go for it.I've done a long-long research on laptops present in this segment and believe me it outperforms em allREAD MORE",8,0
188,Wonderful,5.0,"Since there was no product review available, I am sharing one. This is quite a powerful laptop, which comes with a powerful processor and graphics card in this price range. This is a 8GB DDR5 variant, where you can install another 8GB DDR5 RAM, and comes with a 512GB mini SSD(not the 2280, which is mostly available). This gives you an option to install another M.2 NVME standard PCIE SSD in a blank slot.Other than that, performance is best at this price range. And, since this is a performa...READ MORE",4,0
188,Pretty good,4.0,"its much heavier than the specifications . , its 2.6 kgs not 2.3. The vent is through bottom, so must keep elevated else it heats up.  Very good keyboard , looks good ,,READ MORE",2,0
188,Worth the money,4.0,it does have 4zone back lit keyboard (decent quality)overall build is good no flex and hinge is impressive not wobblyspecifications are best in pricebattery 60watt hr gives decent backup as avg gaming laptop supposed to give display is also decent considering this price 😁READ MORE,2,0
188,Mind-blowing purchase,5.0,At 50k this laptop is beast and also this laptop has rgb lightsREAD MORE,2,0
188,Wonderful,5.0,Quality and performance is best in this price rangeREAD MORE,2,0
188,Classy product,5.0,nice 👍🙂READ MORE,3,1
188,Terrific,5.0,"If you are wondering the keyboard is RGB yes it is, display is not up to the markup in terms of colour reproduction but good for gaming, overall very value for money (50k).READ MORE",2,1
188,Awesome,5.0,Value for the money indeed..READ MORE,0,0
190,Worthless,0.0,After using it 4-5 month I'm changing my review here.Heating problem.Battery backup is not upto the mark.Audio jack stopped working after some time.Hanging issue.Software updation not work properly Don't waste your money to by this dibba. Headache product from Dell.READ MORE,184,29
190,Excellent,5.0,Built Quality Good and Platinum Silver Looks Premium.READ MORE,78,13
190,Super!,5.0,"Mind blowing purchase, its dell everything full fills you...Just got it...The mouse pad✅O.S. Booting vey fast✅Working very smoothly✅Feeling like its worth it✅Very fast laptop✅Guys, really have it..If you are looking for i3 laptop, its totally filled with everything.🤘✅READ MORE",165,37
190,Wonderful,5.0,"It was an excellent deal. Fully satisfied with the product.This one comes with 512gb of nvme ssd which provides lighting fast performance.Display of this laptop is also amazing. This one comes with windows 11 out of the boxI think at this price point it delivers value for money deal, considering brand dell.READ MORE",101,25
190,Perfect product!,5.0,Best building quility also good features right speaker 🔊 have not working properly some scratches are hearingWhen we increase the sound fully  of dj there is an issueREAD MORE,66,15
190,Wonderful,5.0,Totally satisfied with this deal of dell. Worth of money to buy this product. This product though 15.6 but looks like very compact and sound quality is also amazing. Just go for itREAD MORE,103,27
190,Awesome,5.0,Very Amazing laptop. With high quality plastic body. And display and quality both are good.READ MORE,45,9
190,Worthless,0.0,Very badOverheatingWaste of moneyDell service is too bad Flipkart customer service is not helpingThey don't return the order within the return dateREAD MORE,12,1
190,Good choice,4.0,Nice productREAD MORE,7,0
190,Wonderful,4.0,Nyc laptop...READ MORE,10,1
191,Perfect product!,5.0,Beautiful and strong laptopREAD MORE,347,24
191,Classy product,5.0,"Best build Quality Product , Awesome Sound Quality, Display is Awesome, Thank you Realme 😊READ MORE",243,18
191,Perfect product!,5.0,Just amazingREAD MORE,93,8
191,Wonderful,5.0,Value for moneyREAD MORE,176,20
191,Mind-blowing purchase,5.0,This review is after using this lappy for 2 weeks.Pros Excellent displayExcellent build qualityfull metal bodyvery fast performancelow boot timeRAM and Processor are adequate for day to day office and college workonly conbattery backup and charging time are good but not as advertisedREAD MORE,119,12
191,Classy product,5.0,Really amazing at this price range. Really great 👍 work by realme. Loved using it.READ MORE,297,42
191,Classy product,5.0,"Awesome & Cool Design ♥️♥️It's Looks like a MacBook!! Superb fast 🔥🔥I'm Fully Satisfied ☺️ 🥰💪🏻,READ MORE",211,29
191,Great product,4.0,Awesome looks😈 but decent performance and everything speakers are great like a sound 👍READ MORE,98,11
191,Highly recommended,5.0,Love This Product 😍READ MORE,81,9
191,Did not meet expectations,0.0,It's hinges are so bad specifically in Mumbai Area in heavy rainy season it's plastic area of hinges is not good and automatically got damaged and hinges quality is so poor and repair is too costly and  customer service centre is so poor just one i bought and facing problems and i dump my money. This is so bakwas and response of service centre is not goodREAD MORE,34,3
192,Expected a better product,0.0,"They offer free 6 months Microsoft 365 in the flipkart website but its almost 25 days i have not received product key for activating it. When i contacted flipkart they saying there is no such offer😂, cheaters.About laptop performance is ok. Battery backup is poor, and keyboard not at all good most of the key make some cracking sound while pressing especially both sides. To make people believe there are many purchases, flipkart added other/old laptop into same catalogue so when someone chec...READ MORE",683,104
192,Best in the market!,5.0,Amazing at this priceREAD MORE,104,21
192,Awesome,5.0,Best Laptop for Students.READ MORE,155,36
192,Fabulous!,5.0,Best laptop! Value for Money. Good performance and no bugs seen till now. Mouse pad is weak a bit but good for students and binging.READ MORE,33,5
192,Mind-blowing purchase,5.0,Does the job 10/10 for appearance n finishing Backlit cherry on top..READ MORE,15,1
192,Wonderful,5.0,"Excellent laptopDisplay 10/10Keyboard 10/10Performance 10/10Looks 10/10Sound 10/10Forget branded laptop. From long time I used apple, dell, lenovo. All brands are highly costly.Don't go brand. The material inside all of them purchase and assembled. Performance is very far better. Look, design is very good.Specially for student no need waste money on branded laptop.This time flipkart makes delivery solwer. But laptop is just stunning.Every thing is perfect. Before purchase of this la...READ MORE",97,25
192,Good choice,4.0,"Infinix y1 plus 🔥 at this price, i got 23700 in Holi sale,blue colour looks awesome,charging fast🔋 battery backup max 5 hrs for mePerfect and big Display 💻,and big track pad Backlit keyboard looks coolPerformance wise little slower when opening external drives(usb,hdd).but it's ok Finally it's working fine for me.Both side air vent hole placed perfectlyREAD MORE",37,9
192,Fabulous!,5.0,Very good deal. Got this for Rs. 900 per month EMI with exchange offers. Original windows 11 and butter smooth performance. You can even play GTA 5 on this laptop. However sound output is low. Screen is very good. Connectivity is excellent. All in all very good alrounder.READ MORE,69,21
192,Perfect product!,5.0,"I don't know why this laptop get 1-3 stars in some reviews, but i purchased thus laptop today , and this laptop in unbeatable, my avery neighbour is jealus wih this laptop looks, and performance is very amazing. Boot in 8 seconds. Display looks crystal clear. Wifi 5ghz is blezzing fast. This laptop is totally worth itREAD MORE",19,3
192,Good choice,4.0,Nice laptop in this price overall good experience.READ MORE,11,1
193,Best in the market!,5.0,HIGH PERFORMANCE LAPTOPNO HEATING ISSUESREAD MORE,21,5
193,Just wow!,5.0,NiceREAD MORE,9,2
193,Utterly Disappointed,0.0,"Not worth of money, think twice before buyingProblem start after one monthREAD MORE",7,6
194,Simply awesome,5.0,Good product . Just slight viewing angles can be better.  Need to register the warranty by uploading invoice from the purchase datesREAD MORE,17,1
194,Horrible,0.0,"Good laptop at the price point.Has warranty issues, hope brand will fix the problem.Lenovo has worse support personnel, lack of knowledge and handling was very evident .Flipkart do not help , so please be careful while you buy expensive products online.READ MORE",155,39
194,Really Nice,4.0,Value for money productREAD MORE,77,21
194,Wonderful,4.0,Good product by Lenovo design and performance both are perfect.READ MORE,21,3
194,Highly recommended,5.0,Amazing laptop. Takes only 2-3 seconds to boot.Blazing fast. More than expected package.READ MORE,91,26
194,Very poor,0.0,Flipkart says in description that laptop has backlit keyboard and 2 yrs warranty. However laptop do not have backlit keyboard and warranty offered is also 1 yr. It's a fraud they are doing.READ MORE,70,23
194,Utterly Disappointed,0.0,Overheating keypad also heating don't buy anyoneAnd warranty also giving 1 yearHere mentioned 2 years Domestic warrantyBut it is fraud.I am talking to Flipkart about warranty but they are giving negligence answersTotally this deal is fraudREAD MORE,10,1
194,Just okay,3.0,"Very good laptop ,best in this price range, battery and performance are superb, storage and and ram is enough for students,only build quality is not good,feels cheaper in the hands, otherwise best in this price rangeREAD MORE",58,25
194,Wonderful,4.0,"Bootup time is excellent, writing review after one month of usage. Display can be better I am ok with it but not disappointed, As am used to external monitor wondering that's the reason am not impressed with display. Haven't really tested the battery so far, will check and update later.Keys are good and well responsive.READ MORE",21,6
194,Did not meet expectations,0.0,"Battery was too bad, worst laptop, sound quality was too bad, it has no backlight key, slow and patchyREAD MORE",5,0
195,Worth every penny,5.0,Very nice Laptop and 1st charge facilities also available it's look like premium Laptop everyone go for it for professional and personal usage it's work smoothly. I am really happy with it ☺️READ MORE,144,20
195,Terrific purchase,5.0,You definitely buy this good at this price rangeREAD MORE,150,22
195,Mind-blowing purchase,5.0,A good buy for me. Very good performance sleek and light weight and practical. Delivery experience was smoothREAD MORE,88,14
195,Awesome,5.0,After wating a long time I found a such a great laptop. ❤READ MORE,12,0
195,Nice,3.0,It is good 😊😊READ MORE,8,2
196,Best in the market!,5.0,Best Laptop for daily use.READ MORE,3,0
197,Terrific purchase,5.0,Good one! wish it had Oled but this display is good Enough too go for it :) (*it's 5800HS not 5800H)READ MORE,8,0
197,Brilliant,5.0,Good choice...for best office looking with gaming internals...more than  Moderate for gaming under 75k . Overall best choice for those who prefer basic look other than heavy gaming laptops.READ MORE,5,1
197,Nice product,4.0,Best for editingREAD MORE,3,1
197,Good choice,4.0,Overall Laptop is great. But there is no expandable storage and RAM option. This is the only drawback of this laptop. If you are ok with that then go for it.READ MORE,8,8
197,Display quality very poor.   small dots u can properly.,3.0,over all every thing is good but display fell badREAD MORE,1,0
197,Worth every penny,5.0,Classy productREAD MORE,3,5
197,Awesome,5.0,Very good productREAD MORE,0,0
198,Brilliant,5.0,Best laptop for both gaming and study 😉😉😉😉😉😉READ MORE,68,10
198,Wonderful,5.0,Good productREAD MORE,44,7
198,Nice product,4.0,Design Good And Display Mind Good And Performance good but bettery not good but charging speed Super Fast 150w chargeREAD MORE,34,6
198,Perfect product!,5.0,"If you want to buy for coding and gaming,then go for ... super speedREAD MORE",92,25
198,Excellent,5.0,very good laptop for the priceREAD MORE,42,12
198,Awesome,5.0,Very good laptop.READ MORE,6,0
198,Excellent,5.0,"I loved it. Good performance, stylish looks, decent battery for a gaming laptop. The only problem I faced was the wobbling issue but it doesn't affect much. Overall good laptop.READ MORE",20,5
