Product Review ID,Title,rating,detail_review,upvote,downvote
480,Awesome,5.0,Worth the money spent.Got it at 60700/-10 days review -Sound output is less than expected.Display is great.Battery on normal usage up to 3 hrs.Premier pro. After effects. DaVinci. running smoothlyREAD MORE,31,2
480,Good allrounder.,5.0,**GPU's TGP is 55W. | No Advanced Optimus (no MUX switch).**100% sRGB display. Not OLED but works good enough. Slight screen bleeding (faintly visible) on my product but nothing much of a dealbreaker.Build quality is fantastic and feels very premium; the design touches are a lovely sight that keeps it from being too bland.Fans are quite loud during heavy workload (gaming/rendering). Fingerprint sensor is fast and responsive.The camera quality is decent enough. Battery is decent enough a...READ MORE,31,2
480,Good for creative work and casual gaming,3.0,everything is good. there is just screen bleeding issue on my product.READ MORE,100,18
480,Just wow!,5.0,"Got it for 58k in monsoon sale. Value for money product100%srgb display good brightnessGpu TGP is 55 wattVery good for professionalsYou can play heavy games like cyberpunk, Farcy 6, AC Valhalla, medium setting 50 fps1080p video editing is butter smooth 4k mobile footage editing is also smooth Battry backup at 50% brightness with wifi on and normal task office work, web browsing is around 4-5 hrsREAD MORE",28,4
480,Pretty good,4.0,Performance and display is mind-blowing but battery backup and speaker not up to the mark. Overall I love the performance of laptop which i got in my budget 😁READ MORE,21,4
480,Very Good,4.0,"I went in with the laptop, knowing it's drawbacks. V. Poor battery life (~2.5 hrs of average usage)Sub-par cooling for the hardware within. (single fan isn't adequate)Plastic body. (The laptop creaks when you pick it up wrong!)Now, coming  to the reasons you would want this is, Good Performance in games, on a very good screen!The RTX 3050 in this is a bit weird though, 'coz: Cuda cores: 2500  (your avg. RTX 3050 has some 2000 odd CUDA cores)Memory Bandwidth: 64 bits (avg . 3050 has...READ MORE",7,0
480,Perfect product!,5.0,"Perfect product.Everything is good, no negative points. Just go for it and don't think twice, if it is your first Laptop then you are going to have one of the best of all time. Just like a gaming laptop but in a super cool look and thin and lite look. ❤️🔥READ MORE",5,0
480,Nice product,4.0,Display is so good at first I thought it's oled  panel or what.. Performance is amazing Speakers are also goodBattery is actually below average it won't even last 3 hours..This laptop is for creators..READ MORE,7,2
480,Waste of money!,0.0,Display problemREAD MORE,3,0
481,Simply awesome,5.0,I BOUGHT THIS LAPTOP FOR MY STUDIES AND IT IS AWESOME .READ MORE,111,12
481,Value-for-money,4.0,"My first ever laptop - simple & clean UI, also pretty easy to operate. The battery is a fantastic monster, overall happy with the product & total value for money. Cons: poor quality speakers.READ MORE",342,60
481,Must buy!,5.0,Very good. Happy me.READ MORE,39,3
481,Terrific,5.0,"Excellent , truely value for money. Good one for students & also for any normal works.Boots time very fast. Web cam average.READ MORE",62,7
481,Nice,3.0,Fantastic DesignAosome battery Looka premiumREAD MORE,62,7
481,Highly recommended,5.0,"Brought it for my work which most of the time takes place online. This thing much lighter and sleeker compared to my old Toshiba laptop. Love the battery life only have charge once every two days. I have to say I don't really miss anything by using the Chrome OS. But, please don't expect ultrafast performance from it. If you're planning to buy a laptop for work, casual browsing or online classes, I would say go for it.READ MORE",471,93
481,Excellent,5.0,"Nice product. Thanks,  FlipkartREAD MORE",30,2
481,Super!,5.0,If your budget is under 25K go for these Chromebooks.. literally they are the killers in this budget... Do not think about windows.. ..Pros:Superb battery backup of upto 7-8 hrs.. charges within 80 mins... No lags literally... Smooth as butter... design is nice slim and light weightCons: Lack of Few keyboard keys may annoy you..but there are shortcuts for every function... display might be a little better.!READ MORE,65,8
481,Nice,3.0,"It's very nice for day to day school and office work. Serves its purpose completely well. Many android apps are supported already.The only CON it has is its display, its 720p display is worst for viewing any content. You have to view it from the center otherwise colours are not properly visible it you try to view it even from the slightly different angles.Though it has anti-glare display which is the only good thing about its display.Rest, everything is fine about the chromebook, not to ex...READ MORE",167,31
481,Terrific,5.0,Good product in this price.....👍🏻READ MORE,69,11
484,Excellent,5.0,Really So nice laptop. Bulid quality is good. Touch is so smooth workingREAD MORE,19,2
484,Good choice,4.0,"Initial Impression - The built quality is good and appears to be sturdy . Keypad is ergonomically designed and of good quality.  Touch screen is responsive.Cons Battery backup is not so great. The biggest dampner is not providing backlit keyboard. During charging, the laptop did appear slightly warm. At this price, it appears to bit over priced.READ MORE",21,12
484,Just wow!,5.0,Performance 👍 goodREAD MORE,3,0
484,Must buy!,5.0,Nice laptop not for high productivity work. It's a laptop for student and normal work purpose.READ MORE,7,3
484,Brilliant,5.0,One of the best laptop on this price.Its fingerprint word quickly and screen touch display word smoothly just like Mobile phone.Battery performance is not good.It's ram is expandable.Display quality is also goodREAD MORE,2,0
484,Terrific,5.0,Overall a good laptop under 45k.Display is good. Battery is okay. Design is excellent. Compact and easy to carry. Performance is good for normal usage. You can't play games in higher settings. Ryzen 5 5500U is better for gaming in this price range.READ MORE,2,0
484,Absolute rubbish!,0.0,Very badREAD MORE,13,12
484,Good,3.0,Battery back is not adequateAlso sometimes take time to boot when shutdownOtherwise satisfying laptopREAD MORE,1,0
484,Fabulous!,5.0,i am really happy with laptop.READ MORE,1,1
484,Does the job,3.0,"Processing is slow, internet browsing also unlike other systems.READ MORE",0,0
485,Good quality product,4.0,"The product is good and delivered on time by flipkart.At first usage, I can feel the laptop is dissipating more heat via keyboards too. I even places my laptop in a laptop stand for proper air ventilation, even though when running multiple application i can feel some heat dissipating through the keys which is bit uncomfortable while doing work. Camera is bit average only with proper indoor lighting condition i can indentify my face but with more noise/grains in the image.Audio quality is g...READ MORE",23,1
485,Great product,5.0,High performance ⚡️Ryzen 7 ❤READ MORE,15,2
485,Great product,5.0,Nice product from FlipkartREAD MORE,15,2
485,Fabulous!,5.0,Mind blowing performance!READ MORE,2,0
485,Powerful machine on a cheap body.,0.0,"Not an awesome laptop. A budget laptop with very very cheap build quality.The Processor and the RAM capacity are the only pros of this laptop.The cons are an extensive list.- The keyboard looks very cheap. We can't use this for regular use. We have to buy an additional keyboard and Mouse combo.- The Mouse Trackpad is also very cheap.- Overall build quality is very average.- The display is also not bright enough. Usable only in indoor conditions. Even in a small amount of sunlight, we...READ MORE",4,2
485,Not recommended at all,0.0,Heating issue. Laptop heats up within 5 minutes.Display is not so good you can't watch movie from side. Performance is overally good. Battery is overally good.From my personal opinion only disadvantage of this laptop is heating issue and slightly low display quality.READ MORE,1,0
485,Mind-blowing purchase,5.0,GoodREAD MORE,1,0
485,Mind-blowing purchase,5.0,"Absolutely Amazing...slim, lightweight and ample battery life to last half a day. Ryzen 7 gives a smooth performance.  Flipkart delivery within 24 hours was icing on the cake.  Thanks HP and Flipkart.READ MORE",1,0
485,Wonderful,4.0,BestREAD MORE,3,3
485,Brilliant,5.0,Love this product... worth it....value for money....Thanks flipcart family ✨✨💖READ MORE,0,0
486,Absolute rubbish!,0.0,"Wi-Fi, Bluetooth was disconnecting frequently even after all driver updates and Factory Reset. Display was also flickering sometimes. Most of the times, it would start typing on its own. Some of files also got deleted automatically. There was debris under S keycap which was visible after turning on backlit.READ MORE",7,1
487,Simply awesome,5.0,Good product . Just slight viewing angles can be better.  Need to register the warranty by uploading invoice from the purchase datesREAD MORE,17,1
487,Horrible,0.0,"Good laptop at the price point.Has warranty issues, hope brand will fix the problem.Lenovo has worse support personnel, lack of knowledge and handling was very evident .Flipkart do not help , so please be careful while you buy expensive products online.READ MORE",161,42
487,Really Nice,4.0,Value for money productREAD MORE,78,21
487,Highly recommended,5.0,Amazing laptop. Takes only 2-3 seconds to boot.Blazing fast. More than expected package.READ MORE,91,26
487,Wonderful,4.0,Good product by Lenovo design and performance both are perfect.READ MORE,22,4
487,Very poor,0.0,Flipkart says in description that laptop has backlit keyboard and 2 yrs warranty. However laptop do not have backlit keyboard and warranty offered is also 1 yr. It's a fraud they are doing.READ MORE,72,23
487,Utterly Disappointed,0.0,Overheating keypad also heating don't buy anyoneAnd warranty also giving 1 yearHere mentioned 2 years Domestic warrantyBut it is fraud.I am talking to Flipkart about warranty but they are giving negligence answersTotally this deal is fraudREAD MORE,11,1
487,Wonderful,4.0,"Bootup time is excellent, writing review after one month of usage. Display can be better I am ok with it but not disappointed, As am used to external monitor wondering that's the reason am not impressed with display. Haven't really tested the battery so far, will check and update later.Keys are good and well responsive.READ MORE",22,6
487,Just okay,3.0,"Very good laptop ,best in this price range, battery and performance are superb, storage and and ram is enough for students,only build quality is not good,feels cheaper in the hands, otherwise best in this price rangeREAD MORE",58,25
487,Did not meet expectations,0.0,"Battery was too bad, worst laptop, sound quality was too bad, it has no backlight key, slow and patchyREAD MORE",5,0
489,Perfect product!,5.0,"The laptop is good. This is my 1st laptop in my life. I didn't use any laptop till now.  I bought this to do app and game development and some more works. It fill all in level. Battery, graphics, speed. Just 2 seconds to bootup.Heat is ultimate manageableI like the product Military grade but plastic only. But tuf is tough onlyIf u r going to medium gaming and high level too go for this budget beast.And if u r a going to work app development game development or any rendering work it's g...READ MORE",126,15
489,Perfect product!,5.0,"This was my first laptop i get to buy for my self and im more than happy with this product .If your budget is around 55-60 k then this is the number 1 pick you can be rest assured of everything including performance , battery life, build quality and everything else. Trust me its a ""worth every penny"" product. Thanks to asus for this beast😍🤩 and Flipkart for delivering it even though it was one day late 😅READ MORE",67,11
489,Classy product,5.0,SuperREAD MORE,20,3
489,Value-for-money,4.0,Nice product. I bought this for 60k and I bought it for normal use for study and other small purposes. I like the performance and display and only compromise is with battery which drains faster. I recommend everyone to buy this product because at this price range this is best gaming laptop ho for it and thnks flipkart for this product and I am satisfied with delivery experience.READ MORE,13,3
489,Wonderful,5.0,As per Mine View to This Laptop is Great at This Price range but The issue is Battery 🔋 if you Charge it For 100%Then you will be able to use it for Office is 5 Hrs Maximum and if you do a heavy Gaming then you will be able to use it for Atleast 3 hrs.After battery i thing Every Thing is more perfect as I am using Macbook.The Trust of This Lappy is Great to In Future..I am Using it since 2 months and Asus Providing me a Great Touch...Thankyou Asus For making Me Love Youuuu.READ MORE,13,3
489,Terrific purchase,5.0,Beast for a student who belongs to a middle class family 😅...But to be honest it's to sexy 🥵🥵🥶🥶...READ MORE,4,0
489,Highly recommended,5.0,Value for money💸READ MORE,3,0
489,Super!,5.0,Very happy with this price🥰READ MORE,1,0
489,Mind-blowing purchase,5.0,Good product 👍👍READ MORE,1,0
489,Really Nice,0.0,All is good except the battery capacity. You can use it for max 3 hours for normal tasks.READ MORE,3,0
490,Great product,5.0,"Very nice product. Go for it. Fingerprint sensor is shown in pictures, but there is no fingerprint sensor in the machine.READ MORE",0,0
490,Value-for-money,4.0,Best....READ MORE,0,0
492,Best in the market!,5.0,HIGH PERFORMANCE LAPTOPNO HEATING ISSUESREAD MORE,21,5
492,Just wow!,5.0,NiceREAD MORE,9,2
492,Utterly Disappointed,0.0,"Not worth of money, think twice before buyingProblem start after one monthREAD MORE",7,6
493,Best in the market!,5.0,OsmREAD MORE,94,13
493,Fabulous!,5.0,GoodREAD MORE,97,17
493,Delightful,4.0,"Performance is good, sound quality bit lowBattery back up is around 4 hours without heavy gaming with 90wh battery.READ MORE",23,4
493,Fabulous!,5.0,"Build is good. It takes time to boot, about 20 secs. Unable to choose static keyboard Backlit other than red. Perfomence is expected with the card. Heats a lot till 89 degree in just 5 minutes of gaming.READ MORE",120,52
493,Mind-blowing purchase,5.0,Best one in the budget range 65kREAD MORE,13,2
493,Wonderful,5.0,Igot it for 59k in bbd saleDisplay next level Performance beast 🔥Yes heat like 60 to 80 but it automatically cools.in 10 mints with help of fans Plz plug and play nxt level experienceBattery around 3 hrsREAD MORE,6,0
493,Must buy!,5.0,It really awesome.. just go for it... Value for money 💰.... Don't think about seller.... They doing great work... Amazing service...READ MORE,6,0
493,Simply awesome,5.0,"Nice laptop with great design, it is slightly heavy due to that it is not that much portable because of rtx 3050 obviously it is a gaming laptop if you are office person or in business go for asus slimbooks or apple macbooks don't go for heavy laptops... This laptop is best for gamers , video editors and photo editors.READ MORE",6,0
493,Simply awesome,5.0,Good productREAD MORE,8,2
493,Great product,5.0,Simply outstanding just go for itREAD MORE,7,2
495,Highly recommended,5.0,Honestly speaking it's a very good laptop but i literally got heart attack when delivery boy come and laptop is not opening but actually it was not charged but after i charge it 30 min it work fine and it's a very good laptop it has rtx 3050 it supports DLSS also you should go for itREAD MORE,44,6
495,Very Good,4.0,Nice product for high-end user.READ MORE,12,0
495,Perfect product!,5.0,After 1month it's still work smoothly.Till now I'm greatly satisfied with this laptop.Will update here if any problem occurs.READ MORE,10,0
495,Worth every penny,5.0,Super product. Very easy to useREAD MORE,41,13
495,Highly recommended,5.0,"Good Protect, No hanging issues, Photoshop,illustrator, Blender, Video edithing Working goodREAD MORE",7,1
495,Awesome,5.0,"A very good Laptop in this price range. Very quick fingerprint sensor, Camera quality is fine, It is having Backlit keyboard..READ MORE",4,0
495,Brilliant,5.0,If you are looking to buy an all rounder to for it 💯💯Built quality is lit excellent laptop for studentsREAD MORE,6,1
495,Super!,5.0,Hey Guys!I'm writing this review after a month's usage and I hope you can find it helpful.-Firstly the design is superb and the metal body lid strong and becomes chill when the laptop is unused.-The most fabulous factor is the speaker quality of this laptop is just on par to MacBook.- I've bought the 1TB variant and the SSD is lightning fast.-As you know by the specifications the laptop is a power house and thermals are just outstanding with no heat dissipating on the keyboards even when...READ MORE,3,0
495,Brilliant,5.0,Best choice 🔥READ MORE,3,0
495,Wonderful,5.0,After using 1 month I'm writing this reviewThis laptop is very good.it has good performance and everythingBut one thing is that it has low battery backup generally 3-4 hour and gaming laptop has that type range onlyREAD MORE,3,0
496,Super!,5.0,For all those people Who are concerned about the Ram It's Onboard ram With Two 4 GB sticks which makes 8GB ram and IT'S NOT UPGRADABLE...READ MORE,53,4
496,Wonderful,5.0,Makhan leptop 😍..must buy 😊READ MORE,26,2
496,Fabulous!,5.0,Best in the price range.READ MORE,130,28
496,Terrific,5.0,"First of all this is value for money product. If you think that 65k is your budget then obviously you should go for it for business purpose and obviously it's a gaming grade cpu and gpu laptop so any kind of high graphics entry level game you can play in this system. Battery is decent for normal use 3 to 5 hrs for normal use but if you want to use for gaming then you must be plugin the charger. The system have Dolby Atmos for built in speaker, headphones and also inside this system certified ...READ MORE",39,7
496,Terrific purchase,5.0,"The product is very good , if you get it around 50k then it's a good choice better then any other brand laptop , the laptop has all the specs and the performance is very good Only the cons is there is 2 stick of 4gb Ram so if you want to upgrade to 16 GB then you have to remove 2 stick and have to purchase 2 stick of 8 GB thats only fault because I have to purchase 2 stick.Overall I really satisfied from this laptop feels like a macbook in this price I am using since 2 days there is no fau...READ MORE",14,1
496,Excellent,5.0,I bought it on 52k and it is the best laptop on thisREAD MORE,6,0
496,Awesome,5.0,Highly recommendedREAD MORE,5,0
496,Mind-blowing purchase,5.0,"Product is amazing must buy I got this product in 53k best in segment good performance, the best thing with performance it will get finger print unlock buttonRTX 2050 is also a awesome graphicsREAD MORE",4,0
496,Pretty good,4.0,Good product.. silver color is best 🤍READ MORE,4,0
496,Pretty good,4.0,Excellent product 👍READ MORE,4,0
497,Highly recommended,5.0,Very nice product also it has RGB keyboard if anyone is wonderingREAD MORE,12,0
497,Mind-blowing purchase,5.0,"In one word, AMAZINGjust go for it.I've done a long-long research on laptops present in this segment and believe me it outperforms em allREAD MORE",8,0
497,Wonderful,5.0,"Since there was no product review available, I am sharing one. This is quite a powerful laptop, which comes with a powerful processor and graphics card in this price range. This is a 8GB DDR5 variant, where you can install another 8GB DDR5 RAM, and comes with a 512GB mini SSD(not the 2280, which is mostly available). This gives you an option to install another M.2 NVME standard PCIE SSD in a blank slot.Other than that, performance is best at this price range. And, since this is a performa...READ MORE",4,0
497,Pretty good,4.0,"its much heavier than the specifications . , its 2.6 kgs not 2.3. The vent is through bottom, so must keep elevated else it heats up.  Very good keyboard , looks good ,,READ MORE",2,0
497,Worth the money,4.0,it does have 4zone back lit keyboard (decent quality)overall build is good no flex and hinge is impressive not wobblyspecifications are best in pricebattery 60watt hr gives decent backup as avg gaming laptop supposed to give display is also decent considering this price 😁READ MORE,2,0
497,Mind-blowing purchase,5.0,At 50k this laptop is beast and also this laptop has rgb lightsREAD MORE,2,0
497,Wonderful,5.0,Quality and performance is best in this price rangeREAD MORE,2,0
497,Classy product,5.0,nice 👍🙂READ MORE,3,1
497,Terrific,5.0,"If you are wondering the keyboard is RGB yes it is, display is not up to the markup in terms of colour reproduction but good for gaming, overall very value for money (50k).READ MORE",2,1
497,Awesome,5.0,Value for the money indeed..READ MORE,0,0
499,Perfect product!,5.0,Nice product for live streaming....READ MORE,43,2
499,Just wow!,5.0,Worth the money spent. Probably the best laptop series in Indian market with RTX processors. I can smoothly run anything released a of now.READ MORE,27,4
499,Mind-blowing purchase,5.0,Really good product at 81k Really worth itPerformance is awsomeDelivery also goodREAD MORE,14,1
499,Best in the market!,5.0,Laptop in Flipkart  image is different imagination but in reality it's better than imagination. I loved it true. It's true from company product at this price. In picture display feels it not good but display in reality is much nice and good.READ MORE,24,4
499,Excellent,5.0,Absolutely beast Go for it but don't buy it on sale if you need discount you might see price getting up when sales is going on but in 2-3 days price drops like crazy bought this for 79k.Thank you so much to the team for delivering it fast.READ MORE,7,0
499,Nice product,4.0,Battery backup not good but performance really goodREAD MORE,12,2
499,Wonderful,4.0,I am personally happy with the product.READ MORE,6,0
499,Awesome,5.0,"Working fine. Good performance as expected. Only thing I felt disappointed is battery backup time. At this price, a little more capacity battery is expected. Im only getting 3hrs maximum(normal mode - not game mode)READ MORE",11,2
499,Nice product,4.0,okay.READ MORE,10,2
499,Terrific purchase,5.0,ExcellentREAD MORE,13,4
500,Best in the market!,5.0,"Nice laptop, nice price in big billion day saleREAD MORE",18,2
500,Mind-blowing purchase,5.0,Mediocre office rangeREAD MORE,9,1
500,Mind-blowing purchase,5.0,"It's a good laptop and as far as gaming I'm getting 60fps at Genshin, Valorant, Fortnite and Apex at low settings easilyREAD MORE",13,1
500,Fair,3.0,Evening goes well with the product.. except the storage... Even additional hdd slot was not given for the installation of hard-disks Otherwise the looks were stunning!! Fingerprint sensor are absent.READ MORE,22,5
500,Good,3.0,Good qualityREAD MORE,7,1
500,Must buy!,5.0,It is a nice laptop . Value for money . The performance of laptop is so good.Boot time is about 2- 4 sec. Audio quality Is superb.Display is average quality but good in this priceBattery backup is about 7- 8 hours.Design is too good.So this is my review for this laptop I purchased this laptop in big billion days.So yhh I can say it is really a value for money laptopREAD MORE,23,7
500,Simply awesome,5.0,The best laptop at this range and believe me its look so classy a very thin one very light it feels nice to handle one 😊READ MORE,10,2
500,Brilliant,5.0,SuperbREAD MORE,4,1
500,Super!,5.0,Laptop was Awesome Some saids display of this laptop is not good but if you purchase it and feel it yourself you loved the display of this laptop 💻 ...READ MORE,20,11
500,Good quality product,4.0,Best for value Good looking and very nice product 👍🏻READ MORE,2,0
504,Terrific purchase,5.0,"Premium touch, small and handy. Good for daily use and study purpose.READ MORE",25,1
504,Fabulous!,5.0,"ASUS what have you just made Seriously!!!, I got this Laptop at just rs. 41k and to be honest the best purchase of mine till now if you got this one on sale around 40-45 just go for it without even Thinking twice..The usage of yours may vary this laptop is only for the segment of moderate usage, day to day life tasks, Coding and all.This laptop also comes with a Stylus which helps a lot in several areas. Highly Recommended....READ MORE",28,3
504,Perfect product!,5.0,"Undoubtedly best 2in1 laptop in this price range. specs are same if compared to other brands. Decent battery performance ( about 6hrs ). Don't buy it if you need performance oriented laptop but for casual browsing and office work , it'll be just fine. Brightness and display could be better but its okay at this price point. Overall a decent 2in1 laptop.READ MORE",116,34
504,Very Good,4.0,Osm product.READ MORE,18,3
504,Very poor,0.0,I would suggest not to buy laptop from online. I have received defective keyboard in the laptop and it has been 15 days it is still not replaced by flipkart. Very long process to get replacement. Better to buy it offline market without any headache .READ MORE,10,2
504,Good choice,4.0,Purchase it 15days back till now no glitch and it's value for moneyREAD MORE,17,6
504,Wonderful,4.0,All performance are ok but battery backup is less than expectations maximum 2hrs onlyREAD MORE,22,9
504,Just wow!,5.0,Product is undoubtedly Superb under the priceREAD MORE,7,2
504,Wonderful,4.0,For student is well and good. I think 2 in 1 laptop in this range is such a value for money. Specially It's design and speakers I like it. Thank you flipkart for a good product.READ MORE,8,4
504,Brilliant,5.0,Nice product and operated smoothly.READ MORE,1,0
505,Value-for-money,4.0,Go for it.READ MORE,0,0
506,Best in the market!,5.0,HIGH PERFORMANCE LAPTOPNO HEATING ISSUESREAD MORE,20,5
506,Just wow!,5.0,NiceREAD MORE,9,1
506,Utterly Disappointed,0.0,"Not worth of money, think twice before buyingProblem start after one monthREAD MORE",3,1
507,Simply awesome,5.0,Good product . Just slight viewing angles can be better.  Need to register the warranty by uploading invoice from the purchase datesREAD MORE,17,1
